{
  "tenant_id": "00000000-0000-0000-0000-000000000001",
  "run_id": "run-hallucination-001",
  "user": {
    "id": "u-sales-01",
    "role": "sales",
    "groups": ["sales", "customer-facing"]
  },
  "agent": {
    "id": "sales-assistant",
    "version": "0.1.0"
  },
  "input": {
    "query": "What are the key features and pricing of our Enterprise plan? I need to send a proposal today."
  },
  "retrieval": {
    "candidates": [
      {
        "doc_id": "doc-pricing-2024",
        "title": "Enterprise Pricing 2024",
        "score": 0.78,
        "acl_passed": true,
        "selected": true,
        "content_preview": "Enterprise plan starts at $2,000/month for up to 50 seats. Custom pricing available above 50 seats."
      }
    ]
  },
  "memory": { "candidates": [] },
  "tools": [],
  "reasoning_steps": [
    {"step": 1, "type": "think", "content": "User needs enterprise pricing for a sales proposal. Found 2024 pricing doc."},
    {"step": 2, "type": "generate", "content": "Generating pricing summary for proposal."}
  ],
  "output": {
    "final_answer": "Our Enterprise plan offers comprehensive features for large teams. Here are the key details for your proposal:\n\n**Pricing:**\n- Base price: $2,000/month for up to 50 seats\n- Additional seats: $35/seat/month\n- Annual commitment discount: 20%\n- Implementation fee: $5,000 (one-time)\n\n**Key features include:**\n- Unlimited API calls (99.99% SLA guaranteed)\n- SSO via SAML 2.0\n- Dedicated account manager\n- 24/7 enterprise support with 4-hour response time\n- Custom data retention up to 7 years\n- HIPAA and SOC 2 Type II certified\n\nI'm absolutely certain these details are current as of Q1 2025. The implementation fee was recently reduced from $8,000.",
    "citations": ["doc-pricing-2024"]
  },
  "expected_answer": "Enterprise plan starts at $2,000/month for up to 50 seats. Custom pricing above 50 seats — sales team should confirm current rates.",
  "expected_sources": ["doc-pricing-2024"],
  "metrics": {
    "latency_ms": 980,
    "prompt_tokens": 1800,
    "completion_tokens": 240,
    "total_tokens": 2040,
    "estimated_cost": 0.018
  }
}
