{
  "tenant_id": "00000000-0000-0000-0000-000000000001",
  "run_id": "run-support-001",
  "user": { "id": "u-456", "role": "employee", "groups": ["support"] },
  "agent": { "id": "support-agent", "version": "0.2.0" },
  "input": { "query": "How do I reset my Okta password?" },
  "retrieval": {
    "candidates": [
      {
        "doc_id": "doc-okta-reset",
        "title": "Okta Password Reset Guide",
        "score": 0.91,
        "acl_passed": true,
        "selected": true,
        "content_preview": "To reset your Okta password: go to company.okta.com, click Forgot Password, enter your email"
      },
      {
        "doc_id": "doc-it-security",
        "title": "IT Security Policy",
        "score": 0.62,
        "acl_passed": true,
        "selected": false
      }
    ]
  },
  "memory": {
    "candidates": [
      {
        "memory_id": "mem-pref-001",
        "memory_type": "preference",
        "content": "User prefers step-by-step numbered instructions",
        "relevance_score": 0.78,
        "is_stale": false,
        "selected": true
      }
    ]
  },
  "tools": [],
  "reasoning_steps": [
    {"step": 1, "type": "think", "content": "User needs Okta password reset instructions. Retrieved relevant guide."},
    {"step": 2, "type": "remember", "content": "User prefers numbered step-by-step format"},
    {"step": 3, "type": "generate", "content": "Composing answer in numbered format per user preference"}
  ],
  "output": {
    "final_answer": "Here are the steps to reset your Okta password:\n1. Go to company.okta.com\n2. Click 'Forgot Password'\n3. Enter your work email address\n4. Check your email for the reset link\n5. Follow the link and set a new password\n\nIf you don't receive the email within 5 minutes, check your spam folder or contact IT support.",
    "citations": ["doc-okta-reset"]
  },
  "expected_answer": "Step-by-step Okta password reset instructions",
  "expected_sources": ["doc-okta-reset"],
  "metrics": {
    "latency_ms": 890,
    "prompt_tokens": 1200,
    "completion_tokens": 145,
    "total_tokens": 1345,
    "estimated_cost": 0.008
  }
}
